Publishing_Year;Book_Name;Author;Language_Code;Author_Rating;Book_Average_Rating;Book_Ratings_Count;Genre;Gross_Sales;Publisher_Revenue_Verlagumsatz;Sale_Price;Sale_Rank;Publisher;Units_Sold;Buchtitel;Verfilmt?;;
1984;Cold Sassy Tree;Olive Ann Burns;;Intermediate;36220;82281;genre fiction;950.81;570.486;36.342,00  ;751;Random House LLC;42120;Cold Sassy Tree;Ja (TV-Film 1999);Olive Ann Burns;
1945;The Glass Menagerie;Tennessee Williams;eng;Intermediate;24532;90032;nonfiction;117.81;70.686;0.99;752;Amazon Digital Services,  Inc.;41904;The Glass Menagerie;Ja (Film 1950 + Theateradaptionen);Tennessee Williams;
2011;L'amica geniale;Elena Ferrante, Ann Goldstein;eng;Intermediate;32203;64637;nonfiction;912.73;547.638;24.654,00  ;753;Random House LLC;41472;L'amica geniale;Ja (TV-Serie My Brilliant Friend ab 2018);Elena Ferrante, Ann Goldstein;
2007;The 4-Hour Workweek: Escape 9-5, Live Anywhere, and Join the New Rich;Timothy Ferriss;eng;Intermediate;30742;66129;genre fiction;355.81;0.0;36.192,00  ;757;Amazon Digital Services,  Inc.;41256;The 4?Hour Workweek;Nein;Timothy Ferriss;
1996;The Monk Who Sold His Ferrari: A Fable About Fulfilling Your Dreams & Reaching Your Destiny;Robin S. Sharma;eng;Intermediate;28185;52031;genre fiction;117.81;0.0;0.99;759;Amazon Digital Services,  Inc.;40824;The Monk Who Sold His Ferrari;Nein;Robin S. Sharma;
2011;Rules of Civility;Amor Towles;eng;Intermediate;36220;75541;genre fiction;712.81;427.686;36.281,00  ;760;Penguin Group (USA) LLC;40824;Rules of Civility;Nein;Amor Towles;
1970;Ringworld;Larry Niven;eng;Intermediate;35125;76925;genre fiction;117.81;70.686;0.99;760;Amazon Digital Services,  Inc.;40176;Ringworld;In Entwicklung (Serie);Larry Niven;
2011;Between Shades of Gray;Ruta Sepetys;eng;Excellent;13241;87718;genre fiction;236.81;142.086;36.161,00  ;761;Amazon Digital Services,  Inc.;40176;Between Shades of Gray;Ja (Film 2014);Ruta Sepetys;
1996;Frindle;Andrew Clements, Brian Selznick;en-US;Intermediate;28915;83351;genre fiction;712.81;427.686;36.281,00  ;762;Macmillan;39960;Frindle;Nein;Andrew Clements, Brian Selznick;
2009;Dog Days;Jeff Kinney;en-US;Excellent;41730;78592;genre fiction;474.81;0.0;36.220,00  ;764;Amazon Digital Services,  Inc.;39744;Dog Days;Nein (Teil der Diary of a Wimpy Kid-Reihe);Jeff Kinney;
2012;The Round House;Louise Erdrich;eng;Intermediate;33298;67928;genre fiction;355.81;0.0;36.192,00  ;764;Amazon Digital Services,  Inc.;39312;The Round House;Nein;Louise Erdrich;
1973;A Wind in the Door;Madeleine L'Engle;eng;Excellent;45842;87277;genre fiction;355.81;0.0;36.192,00  ;765;Amazon Digital Services,  Inc.;39312;A Wind in the Door;Nein;Madeleine L'Engle;
2012;Free Four: Tobias Tells the Divergent Story;Veronica Roth;eng;Excellent;43191;81621;nonfiction;1188.81;713.286;36.404,00  ;765;Hachette Book Group;38880;Free Four;Nein;Veronica Roth;
2015;A Little Life;Hanya Yanagihara;eng;Excellent;46478;66782;genre fiction;355.81;213.486;36.192,00  ;766;Amazon Digital Services,  Inc.;38664;A Little Life;Nein;Hanya Yanagihara;
2003;Y: The Last Man, Vol. 1: Unmanned;Brian K. Vaughan, Pia Guerra, Jos√É¬© Marz√É¬°n Jr.;eng;Excellent;45995;81326;genre fiction;117.81;0.0;0.99;767;Amazon Digital Services,  Inc.;38664;Y: The Last Man;Ja (TV-Serie 2021, Staffel 2 l‰uft);Brian K. Vaughan, Pia Guerra, Jos√É¬© Marz√É¬°n Jr.;
2011;The Alloy of Law;Brandon Sanderson;eng;Excellent;45692;72185;genre fiction;593.81;0.0;36.251,00  ;768;Amazon Digital Services,  Inc.;38448;The Alloy of Law;Nein;Brandon Sanderson;
2011;Dead Reckoning;Charlaine Harris;eng;Intermediate;28185;87066;nonfiction;117.81;70.686;0.99;770;Amazon Digital Services,  Inc.;38448;Dead Reckoning;Nein;Charlaine Harris;
1985;The Accidental Tourist;Anne Tyler, Jennifer Bassett;eng;Intermediate;45903;80075;genre fiction;784.21;470.526;21.702,00  ;770;Amazon Digital Services,  Inc.;38448;The Accidental Tourist;Ja (Film 1988);Anne Tyler, Jennifer Bassett;
2012;Aristotle and Dante Discover the Secrets of the Universe;Benjamin Alire S√É¬°enz;;Excellent;12510;108884;fiction;1082.9;649.74;45.666,00  ;770;Amazon Digital Services,  Inc.;38232;Aristotle and DanteÖ;In Entwicklung (Film geplant);Benjamin Alire S√É¬°enz;
1897;The Invisible Man;H.G. Wells;eng;Intermediate;22706;84778;genre fiction;117.81;70.686;0.99;772;Macmillan;38016;The Invisible Man;Ja (Film 2020);H.G. Wells;
1985;√§¬∏‚Äì√ß‚Ä¢≈í√£¬Å¬Æ√ß¬µ‚Äö√£‚Äö≈†√£¬Å¬®√£∆í¬è√£∆í¬º√£∆í‚Ä∞√£∆í≈ì√£‚Äö¬§√£∆í¬´√£∆í‚Ä∞√£∆í¬ª√£∆í¬Ø√£∆í¬≥√£∆í‚Ç¨√£∆í¬º√£∆í¬©√£∆í¬≥√£∆í‚Ä∞ [Sekai no owari to h√Ñ¬Ådoboirudo wand√Ñ¬Årando];Haruki Murakami, Alfred Birnbaum;eng;Excellent;42095;63764;genre fiction;117.81;70.686;0.99;773;Amazon Digital Services,  Inc.;38016;????????????????????? (Murakami);Nein;Haruki Murakami, Alfred Birnbaum;
1994;Na margem do rio Piedra eu sentei e chorei;Paulo Coelho, Alan R. Clarke;eng;Intermediate;20880;62106;genre fiction;915.11;549.066;25.385,00  ;775;Random House LLC;37584;Na margem do rio PiedraÖ;Nein;Paulo Coelho, Alan R. Clarke;
1812;Der Schweizerische Robinson;Johann David Wyss, Scott McKowen, Arthur Pober;eng;Intermediate;33664;78355;genre fiction;355.81;0.0;36.192,00  ;779;Amazon Digital Services,  Inc.;37584;Der Schweizerische Robinson;Nein;Johann David Wyss, Scott McKowen, Arthur Pober;
1990;Four Past Midnight;Stephen King;en-GB;Intermediate;45903;76376;nonfiction;640.22;384.132;14.001,00  ;779;HarperCollins Publishers;37368;Four Past Midnight;Nein;Stephen King;
2012;The Marriage Bargain;Jennifer Probst;eng;Intermediate;29646;91630;genre fiction;1307.81;784.686;36.434,00  ;781;Random House LLC;37368;The Marriage Bargain;Nein;Jennifer Probst;
1909;Anne of Avonlea;L.M. Montgomery;en-US;Excellent;44287;99918;genre fiction;117.81;70.686;0.99;782;Amazon Digital Services,  Inc.;37368;Anne of Avonlea;Ja (Miniserie 1987);L.M. Montgomery;
1930;The Little Engine That Could;Watty Piper, Doris Hauman, George Hauman;en-US;Excellent;42095;82102;genre fiction;593.81;0.0;36.251,00  ;783;Amazon Digital Services,  Inc.;37152;The Little Engine That Could;Nein;Watty Piper, Doris Hauman, George Hauman;
2013;We Are All Completely Beside Ourselves;Karen Joy Fowler;eng;Intermediate;25993;59973;genre fiction;355.81;0.0;36.192,00  ;783;Amazon Digital Services,  Inc.;37152;We Are All Completely Beside Ourselves;Nein;Karen Joy Fowler;
1996;Children of the Mind;Orson Scott Card;eng;Intermediate;27089;74517;genre fiction;1022.21;613.326;21.763,00  ;784;Amazon Digital Services,  Inc.;36936;Children of the Mind;Nein;Orson Scott Card;
1922;Ulysses;James Joyce;eng;Intermediate;27089;76791;genre fiction;117.81;0.0;0.99;786;Amazon Digital Services,  Inc.;36936;Ulysses;Nein;James Joyce;
1998;Someone Like You;Sarah Dessen;eng;Intermediate;34394;84358;nonfiction;355.81;213.486;36.192,00  ;786;Simon and Schuster Digital Sales Inc;36936;Someone Like You;Nein;Sarah Dessen;
2003;Moloka'i;Alan Brennert;en-US;Excellent;42095;75307;nonfiction;950.81;570.486;36.342,00  ;787;HarperCollins Christian Publishing;36720;Moloka'i;Ja (Film 1995);Alan Brennert;
1990;The Witching Hour;Anne Rice;eng;Excellent;45661;79824;nonfiction;357.54;214.524;45.719,00  ;789;Amazon Digital Services,  Inc.;36504;The Witching Hour;In Entwicklung (Serie);Anne Rice;
1986;This Present Darkness;Frank E. Peretti;eng;Excellent;45383;71815;genre fiction;352.82;0.0;36.192,00  ;791;Amazon Digital Services,  Inc.;36504;This Present Darkness;Ja (TV-Film 1991);Frank E. Peretti;
2012;The Coincidence of Callie & Kayden;Jessica Sorensen;eng;Excellent;44287;97615;genre fiction;116.82;70.092;0.99;792;Amazon Digital Services,  Inc.;36504;The Coincidence of Callie & Kayden;Nein;Jessica Sorensen;
2015;Fates and Furies;Lauren Groff;eng;Intermediate;20515;66085;genre fiction;862.58;517.548;11.505,00  ;792;HarperCollins Publishers;36504;Fates and Furies;Nein;Lauren Groff;
1998;Summer Sisters;Judy Blume;;Intermediate;30376;73515;genre fiction;862.58;517.548;11.505,00  ;794;Penguin Group (USA) LLC;36504;Summer Sisters;Nein;Judy Blume;
1945;Stuart Little;E.B. White, Garth Williams;en-US;Intermediate;32203;89033;genre fiction;352.82;211.692;36.192,00  ;797;Amazon Digital Services,  Inc.;36504;Stuart Little;Ja (Film 1999);E.B. White, Garth Williams;
1953;The Foundation Trilogy;Isaac Asimov;eng;Excellent;14336;72311;fiction;1060.82;636.492;36.373,00  ;797;HarperCollins Publishers;36504;The Foundation Trilogy;Ja (Foundation-Serie ab 2021);Isaac Asimov;
1999;The Elegant Universe: Superstrings, Hidden Dimensions, and the Quest for the Ultimate Theory;Brian Greene;en-US;Excellent;45812;32626;genre fiction;352.82;0.0;36.192,00  ;798;Amazon Digital Services,  Inc.;36288;The Elegant Universe;Nein;Brian Greene;
2000;The Austere Academy;Lemony Snicket, Brett Helquist;eng;Intermediate;35490;99311;genre fiction;116.82;0.0;0.99;799;Amazon Digital Services,  Inc.;36288;The Austere Academy;Teilweise in Netflix-Serie A Series of Unfortunate Events;Lemony Snicket, Brett Helquist;
2001;Seven Up;Janet Evanovich;en-US;Excellent;42095;94506;genre fiction;1320.42;792.252;43.770,00  ;800;HarperCollins Publishers;36072;Seven Up;Nein;Janet Evanovich;
2009;The Awakening;Kelley Armstrong;eng;Excellent;42461;95026;genre fiction;761.1;456.66;16.589,00  ;802;Simon and Schuster Digital Sales Inc;36072;The Awakening;Nein;Kelley Armstrong;
2003;Death Masks;Jim Butcher;eng;Excellent;11780;83664;children;654.9;392.94;20.210,00  ;802;Amazon Digital Services,  Inc.;36072;Death Masks;Nein;Jim Butcher;
1993;Stellaluna;Janell Cannon;en-US;Excellent;44652;87423;genre fiction;116.82;70.092;0.99;803;Amazon Digital Services,  Inc.;36072;Stellaluna;Nein;Janell Cannon;
2007;Before They Are Hanged;Joe Abercrombie;eng;Excellent;46478;68865;genre fiction;116.82;70.092;0.99;804;Random House LLC;35856;Before They Are Hanged (Joe Abercrombie);Nein ñ es wird aktuell kein TV/Film umgesetzt. Allerdings entsteht eine Verfilmung von Best Served Cold (einem anderen Buch desselben Autors) wearemoviegeeks.com+3texags.com+3trekbbs.com+3texags.com+11winteriscoming.net+11curiousking.co.uk+11;Joe Abercrombie;
2007;Loving Frank;Nancy Horan;en-US;Intermediate;26724;72734;genre fiction;824.82;494.892;36.312,00  ;804;Hachette Book Group;35640;Loving Frank (Nancy Horan);In Entwicklung ñ Lionsgate hat die Rechte erworben, Drehbuch in Arbeit, jedoch noch kein Release;Nancy Horan;
2002;Hard Eight;Janet Evanovich, Lorelei King;en-US;Excellent;42826;93057;nonfiction;1060.82;636.492;36.373,00  ;805;Random House LLC;35640;Hard Eight (Janet Evanovich);Nein;Janet Evanovich, Lorelei King;
2001;The Vile Village;Lemony Snicket, Brett Helquist;eng;Intermediate;34394;89733;genre fiction;706.82;424.092;36.281,00  ;808;Penguin Group (USA) LLC;35640;The Vile Village;Nein;Lemony Snicket, Brett Helquist;
1973;Sybil;Flora Rheta Schreiber;en-US;Intermediate;36220;72493;nonfiction;502.68;301.608;46.113,00  ;809;HarperCollins Publishing;35640;Sybil;Ja ñ TV-Film 1976 & Miniserie 2007;Flora Rheta Schreiber;
1980;Cosmos;Carl Sagan;eng;Excellent;12875;76440;nonfiction;1131.62;678.972;21.794,00  ;810;Penguin Group (USA) LLC;35640;Cosmos (Carl Sagan);Ja ñ popul‰re TV-Doku von 1980, plus Neuauflagen 2014 & 2020;Carl Sagan;
2005;Haunted: A Novel of Stories;Chuck Palahniuk;eng;Intermediate;21610;68861;fiction;234.82;140.892;36.161,00  ;810;Simon and Schuster Digital Sales Inc;35424;Haunted (Chuck Palahniuk);Nein;Chuck Palahniuk;
1987;The Shell Seekers;Rosamunde Pilcher;eng;Excellent;41365;73573;genre fiction;588.82;0.0;36.251,00  ;811;Amazon Digital Services,  Inc.;35424;The Shell Seekers;Ja ñ TV-Film 2006;Rosamunde Pilcher;
2006;What Is the What: The Autobiography of Valentino Achak Deng;Dave Eggers;eng;Excellent;42461;59333;genre fiction;1680.32;1.008.192;14.24;811;Penguin Group (USA) LLC;35424;What Is the What;Nicht verfilmt ñ geplant, aber nie umgesetzt;Dave Eggers;
1981;Cr√É¬≥nica de una muerte anunciada;Gabriel Garc√É¬≠a M√É¬°rquez, Gregory Rabassa;eng;Intermediate;34759;56200;genre fiction;1128.08;676.848;20.699,00  ;813;Simon and Schuster Digital Sales Inc;35208;CrÛnica de una muerte anunciada;Ja ñ Film 1987;Gabriel Garc√É¬≠a M√É¬°rquez, Gregory Rabassa;
1891;A Scandal in Bohemia;Ronald Holt, Arthur Conan Doyle;;Excellent;44652;65422;nonfiction;352.82;211.692;36.192,00  ;814;Amazon Digital Services,  Inc.;35208;A Scandal in Bohemia;Ja ñ Teil diverser Sherlock Holmes-Adaptionen (z.B. BBC);Ronald Holt, Arthur Conan Doyle;
2011;Killing Lincoln: The Shocking Assassination that Changed America Forever;Bill O'Reilly, Martin Dugard;eng;Excellent;45692;71868;children;872.02;523.212;14.427,00  ;816;Amazon Digital Services,  Inc.;35208;Killing Lincoln;Ja ñ TV-Doku 2013;Bill O'Reilly, Martin Dugard;
2013;The Lowland;Jhumpa Lahiri;eng;Intermediate;30011;62231;genre fiction;470.82;282.492;36.220,00  ;818;Amazon Digital Services,  Inc.;35208;The Lowland;In Entwicklung ñ Miniserie geplant, aber noch nicht erschienen;Jhumpa Lahiri;
2004;The Ruins of Gorlan;John Flanagan;eng;Excellent;45692;83085;nonfiction;824.82;494.892;36.312,00  ;818;Random House LLC;34992;The Ruins of Gorlan;In Entwicklung ñ mˆgliche Serie, unbest‰tigt;John Flanagan;
2009;Wintergirls;Laurie Halse Anderson;eng;Intermediate;35855;87665;genre fiction;352.82;0.0;36.192,00  ;819;Amazon Digital Services,  Inc.;34992;Wintergirls;Nein;Laurie Halse Anderson;
2000;The Brethren;John Grisham;;Intermediate;25993;69351;fiction;942.82;565.692;36.342,00  ;820;Penguin Group (USA) LLC;34992;The Brethren (John Grisham);Nein;John Grisham;
1997;Assassin's Quest;Robin Hobb;eng;Excellent;43191;67125;genre fiction;470.82;0.0;36.220,00  ;821;Amazon Digital Services,  Inc.;34776;Assassin's Quest;Nein;Robin Hobb;
1967;Rosemary's Baby;Ira Levin;eng;Intermediate;35125;78766;genre fiction;588.82;0.0;36.251,00  ;823;Amazon Digital Services,  Inc.;34776;Rosemary's Baby;Ja ñ Kultfilm 1968 & Miniserie 2014;Ira Levin;
1984;The Talisman;Stephen King, Peter Straub;en-US;Excellent;45995;79508;nonfiction;234.82;140.892;36.161,00  ;823;Amazon Digital Services,  Inc.;34776;The Talisman;Nein ñ mehrfach in Planung, jedoch nie realisiert;Stephen King, Peter Straub;
1998;The Path of Daggers;Robert Jordan;eng;Intermediate;45903;74815;genre fiction;234.82;140.892;36.161,00  ;824;Amazon Digital Services,  Inc.;34560;The Path of Daggers;Nein;Robert Jordan;
1958;The Dharma Bums;Jack Kerouac;en-US;Intermediate;34394;62454;children;725.7;435.42;42.156,00  ;825;Amazon Digital Services,  Inc.;34560;The Dharma Bums;Nein;Jack Kerouac;
2010;The Reckoning;Kelley Armstrong;en-GB;Excellent;44287;92922;genre fiction;466.83;0.0;36.220,00  ;826;Amazon Digital Services,  Inc.;34560;The Reckoning;Nein;Kelley Armstrong;
2012;Behind the Beautiful Forevers: Life, Death, and Hope in a Mumbai Undercity;Katherine Boo;en-US;Intermediate;35490;69596;fiction;934.83;560.898;36.342,00  ;827;Random House LLC;34344;Behind the Beautiful Forevers;Nein;Katherine Boo;
1934;Mary Poppins;P.L. Travers, Mary Shepard;en-US;Excellent;45781;82706;genre fiction;349.83;209.898;36.192,00  ;830;Amazon Digital Services,  Inc.;34128;Mary Poppins;Ja ñ Disney-Film 1964, mehrere weitere Adaptionen und Serien;P.L. Travers, Mary Shepard;
2007;Red Seas Under Red Skies;Scott Lynch;eng;Excellent;45017;68255;genre fiction;349.83;209.898;36.192,00  ;831;Amazon Digital Services,  Inc.;34128;Red Seas Under Red Skies;Nein;Scott Lynch;
1984;The House on Mango Street;Sandra Cisneros;eng;Intermediate;20880;81579;genre fiction;115.83;0.0;0.99;832;Amazon Digital Services,  Inc.;34128;The House on Mango Street;Nein;Sandra Cisneros;
2008;City of Thieves;David Benioff;en-GB;Excellent;46844;68063;genre fiction;232.83;139.698;36.161,00  ;832;HarperCollins Publishers;34128;City of Thieves;Nein;David Benioff;
2007;Halfway to the Grave;Jeaniene Frost;eng;Excellent;43191;106608;genre fiction;232.83;139.698;36.161,00  ;834;Amazon Digital Services,  Inc.;33912;Halfway to the Grave;Nein;Jeaniene Frost;
1980;The Twits;Roald Dahl, Quentin Blake;eng;Intermediate;34394;82458;genre fiction;855.27;513.162;11.505,00  ;836;Random House LLC;33696;The Twits;Nein;Roald Dahl, Quentin Blake;
2003;Abhorsen;Garth Nix;en-US;Excellent;47209;80740;nonfiction;1519.83;911.898;36.495,00  ;836;Amazon Digital Services,  Inc.;33696;Abhorsen;In Entwicklung ñ Serie angek¸ndigt, noch nicht realisiert;Garth Nix;
2002;The Beach House;James Patterson, Peter de Jonge;eng;Intermediate;30011;68676;genre fiction;466.83;0.0;36.220,00  ;837;Amazon Digital Services,  Inc.;33480;The Beach House;Nein;James Patterson, Peter de Jonge;
1987;Eyes of the Dragon;Stephen King;eng;Intermediate;33664;72714;nonfiction;700.83;420.498;36.281,00  ;837;HarperCollins Publishers;33264;Eyes of the Dragon;In Entwicklung ñ TV-Serie in Planung;Stephen King;
1976;Children of Dune;Frank Herbert;eng;Intermediate;45903;74133;genre fiction;115.83;0.0;0.99;838;Amazon Digital Services,  Inc.;33264;Children of Dune;Ja ñ Miniserie 2003;Frank Herbert;
2011;Leviathan Wakes;James S.A. Corey;eng;Excellent;45692;68416;nonfiction;1689.48;1.013.688;14.44;840;HarperCollins Publishers;33048;Leviathan Wakes;Ja ñ wurde als TV-Serie The Expanse adaptiert;James S.A. Corey;
2015;Queen of Shadows;Sarah J. Maas;eng;Famous;45812;99067;genre fiction;349.83;209.898;36.192,00  ;841;Macmillan;33048;Queen of Shadows;Nein;Sarah J. Maas;
1991;Maus II : And Here My Troubles Began ;Art Spiegelman;eng;Famous;15067;90147;nonfiction;583.83;350.298;36.251,00  ;842;Hachette Book Group;32832;Maus II;Nein;Art Spiegelman;
1962;The Snowy Day;Ezra Jack Keats;eng;Excellent;41365;81914;genre fiction;1170.0;702.0;10.0;843;Amazon Digital Services,  Inc.;32832;The Snowy Day;Nein;Ezra Jack Keats;
2003;To the Nines;Janet Evanovich;eng;Excellent;42461;86963;genre fiction;1402.83;841.698;36.465,00  ;844;Penguin Group (USA) LLC;32832;To the Nines;Nein;Janet Evanovich;
2012;Where We Belong;Emily Giffin;en-US;Intermediate;31472;68224;nonfiction;115.83;0.0;0.99;845;Amazon Digital Services,  Inc.;32616;Where We Belong;Nein;Emily Giffin;
1994;The Hot Zone: The Terrifying True Story of the Origins of the Ebola Virus;Richard   Preston;eng;Excellent;45661;72207;genre fiction;349.83;0.0;36.192,00  ;846;Amazon Digital Services,  Inc.;32616;The Hot Zone;Ja ñ TV-Serie 2019;Richard   Preston;
1999;√£‚Äö¬π√£∆í‚Äî√£∆í¬º√£∆íÀÜ√£∆í‚Äπ√£‚Äö¬Ø√£¬Å¬Æ√¶¬Å‚Äπ√§¬∫¬∫ [Sup√Ö¬´toniku no Koibito];Haruki Murakami, Philip Gabriel;eng;Intermediate;30011;62229;genre fiction;1084.59;650.754;46.631,00  ;846;Penguin Group (USA) LLC;32616;Attack on Titan (Japanisch/Eiichiro Oda);Ja ñ erfolgreiche Anime-Serie + Realfilme in Japan;Haruki Murakami, Philip Gabriel;
2012;The Signature of All Things;Elizabeth Gilbert;eng;Intermediate;29646;61135;nonfiction;232.83;139.698;36.161,00  ;848;Amazon Digital Services,  Inc.;32400;The Signature of All Things;Nein;Elizabeth Gilbert;
2003;Eats, Shoots and Leaves;Lynne Truss;en-US;Intermediate;31472;79117;genre fiction;466.83;0.0;36.220,00  ;852;Amazon Digital Services,  Inc.;32184;Eats, Shoots and Leaves;Nein;Lynne Truss;
2004;Dead Witch Walking;Kim Harrison;en-US;Excellent;45751;91390;nonfiction;349.83;0.0;36.192,00  ;852;Amazon Digital Services,  Inc.;32184;Dead Witch Walking;Nein;Kim Harrison;
1986;;Clement C. Moore, Jan Brett;en-US;Excellent;13241;81553;genre fiction;466.83;0.0;36.220,00  ;853;Amazon Digital Services,  Inc.;32184;(Weihnachtsgedicht) Clement C. Moore, Jan Brett;Ja*;Clement C. Moore, Jan Brett;
2009;An Echo in the Bone;Diana Gabaldon;eng;Famous;15432;68854;genre fiction;1391.13;834.678;32.813,00  ;854;Simon and Schuster Digital Sales Inc;32184;An Echo in the Bone;Ja;Diana Gabaldon;
2011;Unearthly;Cynthia Hand;en-US;Excellent;45812;99942;genre fiction;232.83;139.698;36.161,00  ;857;Hachette Book Group;31968;Unearthly;Nein;Cynthia Hand;
1988;The Case for Christ;Lee Strobel;;Excellent;45661;67128;genre fiction;799.11;479.466;30.468,00  ;859;Macmillan;31752;The Case for Christ;Ja;Lee Strobel;
2005;Knife of Dreams;Robert Jordan;en-US;Excellent;45995;71379;genre fiction;349.83;0.0;36.192,00  ;860;Amazon Digital Services,  Inc.;31752;Knife of Dreams;Teilweise*;Robert Jordan;
2002;Hoot;Carl Hiaasen;eng;Intermediate;29646;75275;genre fiction;583.83;350.298;36.251,00  ;862;Penguin Group (USA) LLC;31752;Hoot;Ja;Carl Hiaasen;
-17;√É‚Ä†neis;Virgil, Robert Fitzgerald;eng;Intermediate;29646;75051;genre fiction;114.84;0.0;0.99;863;Amazon Digital Services,  Inc.;31752;√É‚Ä†neis;Nein;Virgil, Robert Fitzgerald;
2012;This is How You Lose Her;Junot D√É¬≠az;eng;Intermediate;27454;66720;nonfiction;624.08;374.448;14.001,00  ;865;Amazon Digital Services,  Inc.;31536;This is How You Lose Her;Nein;Junot D√É¬≠az;
2004;√£‚Äö¬¢√£∆í‚Ä¢√£‚Äö¬ø√£∆í¬º√£∆í‚Ç¨√£∆í¬º√£‚Äö¬Ø [Afut√Ñ¬Å d√Ñ¬Åku];Haruki Murakami, Jay Rubin;eng;Intermediate;24898;64278;genre fiction;694.84;0.0;36.281,00  ;866;Amazon Digital Services,  Inc.;31536;√£‚Äö¬¢√£∆í‚Ä¢√£‚Äö¬ø√£∆í¬º√£∆í‚Ç¨√£∆í¬º√£‚Äö¬Ø [Afut√Ñ¬Å d√Ñ¬Åku];Nein;Haruki Murakami, Jay Rubin;
1992;Ishmael: An Adventure of the Mind and Spirit;Daniel Quinn;en-US;Intermediate;35490;63304;genre fiction;892.04;535.224;25.385,00  ;867;Random House LLC;31536;Ishmael: An Adventure of the Mind and Spirit;Nein;Daniel Quinn;
2010;It's Not Summer Without You;Jenny Han;en-US;Excellent;41730;80367;genre fiction;346.84;0.0;36.192,00  ;868;Amazon Digital Services,  Inc.;31536;It's Not Summer Without You;Teilweise*;Jenny Han;
2012;Pushing the Limits;Katie McGarry;eng;Excellent;45873;93818;genre fiction;462.84;0.0;36.220,00  ;869;Amazon Digital Services,  Inc.;31320;Pushing the Limits;Nein;Katie McGarry;
2001;Quidditch Through the Ages;Kennilworthy Whisp, J.K. Rowling;eng;Intermediate;31107;90908;genre fiction;114.84;68.904;0.99;869;Random House LLC;31320;Quidditch Through the Ages;Nein;Kennilworthy Whisp, J.K. Rowling;
1977;Miss Nelson Is Missing!;Harry Allard, James  Marshall;eng;Excellent;46113;77206;genre fiction;1158.84;695.304;36.404,00  ;871;Penguin Group (USA) LLC;31320;Miss Nelson Is Missing!;Nein;Harry Allard, James  Marshall;
1979;The Long Walk;Richard Bachman, Stephen King;eng;Excellent;45965;71775;nonfiction;462.84;277.704;36.220,00  ;871;Hachette Book Group;31320;The Long Walk;In Planung;Richard Bachman, Stephen King;
2001;The Ersatz Elevator;Lemony Snicket, Brett Helquist;eng;Excellent;45661;90071;nonfiction;230.84;138.504;36.161,00  ;873;Random House LLC;31104;The Ersatz Elevator;Ja (Serie);Lemony Snicket, Brett Helquist;
2004;Messenger ;Lois Lowry;eng;Intermediate;45903;79746;genre fiction;462.84;277.704;36.220,00  ;877;Amazon Digital Services,  Inc.;30888;Messenger;Nein;Lois Lowry;
2007;Lover Revealed;J.R. Ward;eng;Excellent;45720;97830;genre fiction;694.84;0.0;36.281,00  ;879;Amazon Digital Services,  Inc.;30888;Lover Revealed;Nein;J.R. Ward;
2005;'Salem's Lot The Illustrated Edition;Stephen King, Jerry N. Uelsmann;eng;Excellent;45748;72797;genre fiction;770.24;462.144;23.529,00  ;879;Hachette Book Group;30672;'Salem's Lot The Illustrated Edition;Ja;Stephen King, Jerry N. Uelsmann;
2007;The Mysterious Benedict Society;Trenton Lee Stewart, Carson Ellis;en-US;Excellent;41730;87335;genre fiction;114.84;68.904;0.99;881;Amazon Digital Services,  Inc.;30672;The Mysterious Benedict Society;Ja (Serie);Trenton Lee Stewart, Carson Ellis;
2007;God is Not Great: How Religion Poisons Everything;Christopher Hitchens;eng;Intermediate;35125;64347;children;694.84;416.904;36.281,00  ;883;Amazon Digital Services,  Inc.;30456;God is Not Great: How Religion Poisons Everything;Nein;Christopher Hitchens;
2013;Never Too Far (Too Far, #2);Abbi Glines;eng;Excellent;44287;97616;genre fiction;114.84;68.904;0.99;884;Amazon Digital Services,  Inc.;30456;Never Too Far (Too Far, #2);Nein;Abbi Glines;
2004;State of Fear;Michael Crichton;eng;Intermediate;25263;65397;genre fiction;114.84;68.904;0.99;885;Amazon Digital Services,  Inc.;30240;State of Fear;Nein;Michael Crichton;
2012;The Statistical Probability of Love at First Sight;Jennifer E. Smith;eng;Intermediate;45872;89356;genre fiction;114.84;0.0;0.99;886;Amazon Digital Services,  Inc.;30240;The Statistical Probability of Love at First Sight;Ja;Jennifer E. Smith;
2004;The Golem's Eye;Jonathan Stroud;en-US;Excellent;45904;69058;nonfiction;810.84;486.504;36.312,00  ;886;Simon and Schuster Digital Sales Inc;29808;The Golem's Eye;Nein;Jonathan Stroud;
1980;Still Life with Woodpecker;Tom Robbins;eng;Excellent;45751;56802;genre fiction;346.84;0.0;36.192,00  ;887;Amazon Digital Services,  Inc.;29808;Still Life with Woodpecker;Nein;Tom Robbins;
2004;Those Who Save Us;Jenna Blum;en-US;Excellent;45995;68480;genre fiction;114.84;0.0;0.99;890;Amazon Digital Services,  Inc.;29808;Those Who Save Us;Ja (TV-Film);Jenna Blum;
2005;The Broker;John Grisham;eng;Intermediate;28185;65428;genre fiction;114.84;68.904;0.99;892;Amazon Digital Services,  Inc.;29592;The Broker;Nein;John Grisham;
2011;Across the Universe;Beth Revis;eng;Intermediate;28550;94176;genre fiction;462.84;0.0;36.220,00  ;892;Amazon Digital Services,  Inc.;29376;Across the Universe;Nein;Beth Revis;
1978;The Road Less Traveled:  A New Psychology of Love, Traditional Values, and Spiritual Growth;M. Scott Peck;en-US;Excellent;45720;61238;nonfiction;1042.84;625.704;36.373,00  ;893;Amazon Digital Services,  Inc.;29160;The Road Less Traveled: A New Psychology of Love, Traditional Values, and Spiritual Growth;Nein;M. Scott Peck;
2004;Blood Rites;Jim Butcher;eng;Excellent;12145;79627;nonfiction;1041.68;625.008;36.008,00  ;894;Amazon Digital Services,  Inc.;28944;Blood Rites;Nein;Jim Butcher;
