Publishing_Year;Book_Name;Author;Language_Code;Author_Rating;Book_Average_Rating;Book_Ratings_Count;Genre;Gross_Sales;Publisher_Revenue_Verlagumsatz;Sale_Price;Sale_Rank;Publisher;Units_Sold;Buchtitel;Verfilmt?;;
1975;Beowulf;Unknown, Seamus Heaney;en-US;Novice;15401;155903;genre fiction;34160.0;20496.0;32.234,00  ;1;HarperCollins Publishers;7000;Beowulf;Ja;;
1987;Batman: Year One;Frank Miller, David Mazzucchelli, Richmond Lewis, Dennis O'Neil;eng;Intermediate;45017;145267;genre fiction;12437.5;7462.5;36.161,00  ;2;HarperCollins Publishers;6250;Batman: Year One;Ja (animiert);;
2015;Go Set a Watchman;Harper Lee;eng;Novice;11383;138669;genre fiction;47795.0;28677.0;25.416,00  ;3;Amazon Digital Services,  Inc.;5500;Go Set a Watchman;Nein;;
2008;When You Are Engulfed in Flames;David Sedaris;en-US;Intermediate;45751;150898;fiction;41250.0;24750.0;45.784,00  ;3;Hachette Book Group;5500;When You Are Engulfed in Flames;Nein;;
2011;Daughter of Smoke & Bone;Laini Taylor;eng;Intermediate;45751;198283;genre fiction;37952.5;22771.5;36.342,00  ;4;Penguin Group (USA) LLC;4750;Daughter of Smoke & Bone;In Entwicklung;;
2015;Red Queen;Victoria Aveyard;eng;Intermediate;45873;83354;genre fiction;19960.0;0.0;36.251,00  ;5;Amazon Digital Services,  Inc.;4000;Red Queen;Nein;;
2011;The Power of Habit;Charles Duhigg;eng;Intermediate;45720;155977;genre fiction;27491.67;16.495.002;36.312,00  ;6;HarperCollins Publishers;3933;The Power of Habit;Nein;;
1994;Midnight in the Garden of Good and Evil;John Berendt;eng;Intermediate;45903;167997;nonfiction;26182.0;15709.2;32.660,00  ;8;Hachette Book Group;3800;Midnight in the Garden of Good and Evil;Ja;;
2012;Hopeless;Colleen Hoover;eng;Intermediate;12510;189938;genre fiction;26093.67;15.656.202;36.312,00  ;9;HarperCollins Publishers;3733;Hopeless;Nein;;
1905;A Little Princess;Frances Hodgson Burnett, Nancy Bond;eng;Intermediate;45692;199872;genre fiction;23792.34;14.275.404;18.050,00  ;10;Random House LLC;3666;A Little Princess;Ja;;
2004;The Truth About Forever;Sarah Dessen;en-US;Intermediate;41365;179415;genre fiction;17964.0;0.0;36.251,00  ;11;Amazon Digital Services,  Inc.;3600;The Truth About Forever;Nein;;
1954;The horse and his boy;C.S. Lewis;eng;Intermediate;45903;189671;fiction;21564.0;12938.4;36.281,00  ;11;Penguin Group (USA) LLC;3600;The Horse and His Boy;Ja;;
2010;Last Sacrifice ;Richelle Mead;eng;Famous;15432;206792;genre fiction;3431.34;0.0;0.99;13;Amazon Digital Services,  Inc.;3466;Last Sacrifice;Nein;;
1935;Little House on the Prairie;Laura Ingalls Wilder, Garth Williams;eng;Intermediate;43191;195424;genre fiction;6897.34;4.138.404;36.161,00  ;13;HarperCollins Publishers;3466;Little House on the Prairie;Ja (TV-Serie);;
1922;The Velveteen Rabbit;Margery Williams Bianco, William   Nicholson;eng;Intermediate;47209;173469;genre fiction;21797.82;13.078.692;19.876,00  ;15;Random House LLC;3333;The Velveteen Rabbit;Ja;;
1974;Zen and the Art of Motorcycle Maintenance;Robert M. Pirsig;eng;Intermediate;27820;139411;genre fiction;16297.34;0.0;36.251,00  ;16;Amazon Digital Services,  Inc.;3266;Zen and the Art of Motorcycle Maintenance;Nein (geplant);;
1897;The War of the Worlds;H.G. Wells, Arthur C. Clarke;eng;Intermediate;45872;159752;genre fiction;15968.0;0.0;36.251,00  ;17;Amazon Digital Services,  Inc.;3200;The War of the Worlds;Ja;;
2006;Pretty Little Liars;Sara Shepard;en-US;Intermediate;45903;156328;genre fiction;15968.0;0.0;36.251,00  ;17;Amazon Digital Services,  Inc.;3200;Pretty Little Liars;Ja (TV-Serie);;
1948;Corduroy;Don Freeman;en-US;Intermediate;46844;160860;genre fiction;6234.67;3.740.802;36.161,00  ;18;Simon and Schuster Digital Sales Inc;3133;Corduroy;Ja;;
2006;The Omnivore's Dilemma;Michael Pollan;eng;Intermediate;42826;133271;genre fiction;3035.34;0.0;0.99;19;Amazon Digital Services,  Inc.;3066;The Omnivore's Dilemma;Nein;;
2013;Life After Life;Kate Atkinson;eng;Intermediate;27089;138454;genre fiction;11702.67;0.0;36.220,00  ;21;Amazon Digital Services,  Inc.;2933;Life After Life;In Entwicklung;;
2000;The Rescue;Nicholas Sparks;en-US;Intermediate;45661;142092;genre fiction;8569.34;0.0;36.192,00  ;22;Amazon Digital Services,  Inc.;2866;The Rescue;Nein;;
1991;Needful Things;Stephen King;;Intermediate;31837;153821;genre fiction;2772.0;0.0;0.99;23;Amazon Digital Services,  Inc.;2800;Needful Things;Ja;;
1993;Voyager;Diana Gabaldon;eng;Intermediate;13971;157395;genre fiction;8171.67;0.0;36.192,00  ;24;Amazon Digital Services,  Inc.;2733;Voyager;Ja (TV-Serie);;
1996;;Kenneth Branagh, William Shakespeare;eng;Intermediate;45995;156869;genre fiction;2639.34;1.583.604;0.99;25;Amazon Digital Services,  Inc.;2666;;;;
1981;Cujo;Stephen King;spa;Intermediate;23802;158215;genre fiction;7774.0;0.0;36.192,00  ;26;Amazon Digital Services,  Inc.;2600;Cujo;Ja;;
1993;The Virgin Suicides;Jeffrey Eugenides;eng;Intermediate;30376;159249;genre fiction;26904.06;16.142.436;33.512,00  ;28;Penguin Group (USA) LLC;2466;The Virgin Suicides;Ja;;
2004;Dead to the World;Charlaine Harris;eng;Intermediate;41365;199572;genre fiction;2376.0;0.0;0.99;29;Amazon Digital Services,  Inc.;2400;Dead to the World;Nein;;
1891;Tess of the d'Urbervilles: A Pure Woman Faithfully Presented;Thomas Hardy, Tim Dolin, Margaret R. Higonnet;eng;Intermediate;28185;171599;nonfiction;9576.0;5745.6;36.220,00  ;29;Hachette Book Group;2400;Tess of the d'Urbervilles;Ja;;
1856;Madame Bovary;Gustave Flaubert, Margaret Mauldon, Malcolm Bowie, Mark Overstall;eng;Intermediate;23437;158877;genre fiction;9308.67;0.0;36.220,00  ;30;Amazon Digital Services,  Inc.;2333;Madame Bovary;Ja;;
1961;The Phantom Tollbooth;Norton Juster, Jules Feiffer;en-US;Intermediate;44652;178432;genre fiction;4509.34;0.0;36.161,00  ;31;Amazon Digital Services,  Inc.;2266;The Phantom Tollbooth;Ja;;
2010;The Way of Kings;Brandon Sanderson;eng;Famous;23468;144822;genre fiction;2178.0;0.0;0.99;32;Amazon Digital Services,  Inc.;2200;The Way of Kings;Nein;;
2003;Club Dead;Charlaine Harris;en-GB;Intermediate;45720;181323;genre fiction;13178.0;7906.8;36.281,00  ;32;HarperCollins Publishers;2200;Club Dead;Nein;;
2006;It's Kind of a Funny Story;Ned Vizzini;en-US;Intermediate;41730;161001;nonfiction;2045.34;1.227.204;0.99;34;HarperCollins Publishers;2066;It's Kind of a Funny Story;Ja;;
2007;;Brandon Sanderson;eng;Intermediate;12875;150736;genre fiction;17980.0;10788.0;36.373,00  ;35;Random House LLC;2000;;;;
2015;After You;Jojo Moyes;eng;Intermediate;45841;99342;genre fiction;1964.16;0.0;0.99;36;Amazon Digital Services,  Inc.;1984;After You;Nein;;
2011;The Language of Flowers;Vanessa Diffenbaugh;eng;Intermediate;45842;140076;genre fiction;1964.16;1.178.496;0.99;36;Amazon Digital Services,  Inc.;1984;The Language of Flowers;Nein;;
1986;Batman: The Dark Knight Returns;Frank Miller, Klaus Janson, Lynn Varley;eng;Intermediate;45748;135979;genre fiction;1949.31;0.0;0.99;37;Amazon Digital Services,  Inc.;1969;Batman: The Dark Knight Returns;Ja (animiert);;
2005;The Angel Experiment;James Patterson;eng;Intermediate;45873;172302;genre fiction;1949.31;0.0;0.99;37;Amazon Digital Services,  Inc.;1969;The Angel Experiment;Nein;;
1995;High Fidelity;Nick Hornby;eng;Intermediate;34394;134849;genre fiction;20309.55;12185.73;24.016,00  ;41;Random House LLC;1907;High Fidelity;Ja;;
2003;The Guardian;Nicholas Sparks;en-US;Intermediate;41730;136427;genre fiction;1873.08;0.0;0.99;42;Amazon Digital Services,  Inc.;1892;The Guardian;Ja;;
2003;Oryx and Crake;Margaret Atwood;eng;Intermediate;4.0;151500;genre fiction;7485.24;0.0;36.220,00  ;43;Amazon Digital Services,  Inc.;1876;Oryx and Crake;Nein;;
1998;Men Are from Mars, Women Are from Venus Book of Days: 365 Inspirations to Enrich Your Relationships;John Gray;en-US;Intermediate;19054;113915;genre fiction;3703.39;2.222.034;36.161,00  ;44;Amazon Digital Services,  Inc.;1861;Men Are from Mars, Women Are from Venus;Nein;;
2000;Kitchen Confidential: Adventures in the Culinary Underbelly;Anthony Bourdain;eng;Intermediate;4.0;134177;genre fiction;11057.54;6.634.524;36.281,00  ;45;HarperCollins Publishers;1846;Kitchen Confidential;Ja (TV-Serie);;
1999;Timeline;Michael Crichton;en-US;Intermediate;30376;148563;genre fiction;12791.7;7675.02;36.312,00  ;46;Amazon Digital Services,  Inc.;1830;Timeline;Ja;;
1759;Candide;Voltaire;eng;Intermediate;27820;151471;genre fiction;8982.0;0.0;36.251,00  ;48;Amazon Digital Services,  Inc.;1800;Candide;Ja;;
1975;Tuck Everlasting;Natalie Babbitt;eng;Intermediate;31107;174280;nonfiction;3582.0;2149.2;36.161,00  ;48;Amazon Digital Services,  Inc.;1800;Tuck Everlasting;Ja;;
1983;Christine;Stephen King, Marie Milpois;fre;Intermediate;26359;151160;nonfiction;1766.16;1.059.696;0.99;49;Amazon Digital Services,  Inc.;1784;Christine;Ja;;
1960;Are You My Mother?;P.D. Eastman;eng;Intermediate;42461;174204;genre fiction;10596.31;6.357.786;36.281,00  ;50;Penguin Group (USA) LLC;1769;Are You My Mother?;Nein;;
1950;The Story of Art;E.H. Gombrich;en-US;Intermediate;30376;164708;genre fiction;15058.27;9.034.962;21.763,00  ;51;Hachette Book Group;1753;The Story of Art;Nein;;
2013;Scarlet;Marissa Meyer;eng;Intermediate;45720;193766;genre fiction;1720.62;1.032.372;0.99;52;Amazon Digital Services,  Inc.;1738;Scarlet;Nein;;
1997;Rich Dad , Poor Dad;Robert T. Kiyosaki;eng;Intermediate;34759;153764;genre fiction;1705.77;1.023.462;0.99;53;Random House LLC;1723;Rich Dad, Poor Dad;Nein;;
2011;Silence ;Becca Fitzpatrick;eng;Intermediate;42461;190722;genre fiction;8517.93;0.0;36.251,00  ;54;Amazon Digital Services,  Inc.;1707;Silence;Ja;;
2009;The Magicians;Lev Grossman;eng;Novice;17227;147908;genre fiction;1675.08;1.005.048;0.99;55;Macmillan;1692;The Magicians;Ja (TV-Serie);;
2004;√£∆í‚Ä°√£‚Äö¬π√£∆í≈Ω√£∆í¬º√£∆íÀÜ #1 (Desu N√Ö¬çto) Taikutsu (√©‚Ç¨‚Ç¨√•¬±ÀÜ);Tsugumi Ohba, Takeshi Obata;eng;Famous;15432;139501;genre fiction;6687.24;0.0;36.220,00  ;56;Amazon Digital Services,  Inc.;1676;;;;
2003;A Great and Terrible Beauty;Libba Bray;eng;Intermediate;28915;173613;genre fiction;4966.39;2.979.834;36.192,00  ;57;Penguin Group (USA) LLC;1661;A Great and Terrible Beauty;Ja;;
2002;Everything Is Illuminated;Jonathan Safran Foer;eng;Intermediate;45903;131492;genre fiction;1629.54;977.724;0.99;58;Amazon Digital Services,  Inc.;1646;Everything Is Illuminated;Ja;;
1986;The Bourne Supremacy;Robert Ludlum;en-US;Intermediate;45904;142168;genre fiction;17783.3;10669.98;33.512,00  ;59;Penguin Group (USA) LLC;1630;The Bourne Supremacy;Ja;;
2012;Easy;Tammara Webber;en-CA;Intermediate;45965;133937;genre fiction;1613.7;0.0;0.99;59;Amazon Digital Services,  Inc.;1630;Easy;Nein;;
1849;David Copperfield;Charles Dickens, Jeremy Tambling;eng;Intermediate;35125;150512;genre fiction;18394.85;11036.91;14.550,00  ;60;Hachette Book Group;1615;David Copperfield;Ja;;
2007;The Absolutely True Diary of a Part-Time Indian;Sherman Alexie, Ellen Forney;eng;Intermediate;45965;160607;genre fiction;10384.0;6230.4;18.050,00  ;61;Random House LLC;1600;The Absolutely True Diary of a Part-Time Indian;Nein;;
1967;√ê≈ì√ê¬∞√ë¬Å√ë‚Äö√ê¬µ√ë‚Ç¨ √ê¬∏ √ê≈ì√ê¬∞√ë‚Ç¨√ê¬≥√ê¬∞√ë‚Ç¨√ê¬∏√ë‚Äö√ê¬∞;Mikhail Bulgakov, Katherine Tiernan O'Connor, Diana Burgin, Ellendea Proffer;eng;Intermediate;11780;131389;genre fiction;6320.16;0.0;36.220,00  ;62;Amazon Digital Services,  Inc.;1584;;;;
1968;A Wizard of Earthsea;Ursula K. Le Guin;en-US;Intermediate;36220;155042;genre fiction;4707.0;0.0;3.0;63;Amazon Digital Services,  Inc.;1569;A Wizard of Earthsea;Nein;;
2000;Because of Winn-Dixie;Kate DiCamillo, Chris Sheban;eng;Intermediate;4.0;154476;genre fiction;1522.62;0.0;0.99;65;Amazon Digital Services,  Inc.;1538;Because of Winn-Dixie;Ja;;
1959;A Separate Peace;John Knowles;en-US;Intermediate;20515;155901;genre fiction;5924.47;0.0;32.568,00  ;66;Amazon Digital Services,  Inc.;1523;A Separate Peace;Ja;;
1995;The Rainmaker;John Grisham;eng;Intermediate;33298;137412;genre fiction;12040.93;0.0;36.342,00  ;67;Amazon Digital Services,  Inc.;1507;The Rainmaker;Ja;;
1605;Don Quijote de La Mancha;Miguel de Cervantes Saavedra, Roberto Gonz√É¬°lez Echevarr√É¬≠a, John Rutherford;eng;Intermediate;31107;134931;genre fiction;13413.08;8.047.848;36.373,00  ;68;Hachette Book Group;1492;Don Quijote de La Mancha;Ja;;
1995;Assassin's Apprentice;Robin Hobb;eng;Intermediate;41730;132777;genre fiction;2907.39;0.0;36.161,00  ;70;Amazon Digital Services,  Inc.;1461;Assassin's Apprentice;Nein;;
1980;The Restaurant at the End of the Universe;Douglas Adams;eng;Intermediate;44652;153838;genre fiction;11553.54;6.932.124;36.342,00  ;71;Penguin Group (USA) LLC;1446;The Restaurant at the End of the Universe;Nein;;
2010;Torment;Lauren Kate;eng;Intermediate;32568;174393;genre fiction;5705.7;0.0;36.220,00  ;72;Amazon Digital Services,  Inc.;1430;Torment;Nein;;
1901;The Tale of Peter Rabbit;Beatrix Potter;eng;Intermediate;42826;162373;genre fiction;9890.85;5934.51;36.312,00  ;73;Penguin Group (USA) LLC;1415;The Tale of Peter Rabbit;Ja;;
1953;The Silver Chair;C.S. Lewis, Pauline Baynes;eng;Intermediate;34759;170453;genre fiction;5245.36;3.147.216;28.915,00  ;75;Hachette Book Group;1384;The Silver Chair;Ja (geplant);;
2008;The Hero of Ages;Brandon Sanderson;eng;Famous;16893;143622;nonfiction;5826.64;3.495.984;44.287,00  ;75;Amazon Digital Services,  Inc.;1384;The Hero of Ages;Nein;;
1993;Girl, Interrupted;Susanna Kaysen;eng;Intermediate;45903;145161;genre fiction;2724.31;1.634.586;36.161,00  ;76;Hachette Book Group;1369;Girl, Interrupted;Ja;;
2007;Are You There, Vodka? It's Me, Chelsea;Chelsea Handler;;Intermediate;31107;127096;genre fiction;5462.31;3.277.386;36.220,00  ;76;Hachette Book Group;1369;Are You There, Vodka? It's Me, Chelsea;Ja;;
1970;Jonathan Livingston Seagull;Richard Bach, Russell Munson;en-US;Intermediate;45872;133728;genre fiction;6751.47;0.0;36.251,00  ;77;Amazon Digital Services,  Inc.;1353;Jonathan Livingston Seagull;Ja;;
2014;City of Heavenly Fire;Cassandra Clare;eng;Famous;17624;177796;genre fiction;6676.62;0.0;36.251,00  ;78;Amazon Digital Services,  Inc.;1338;City of Heavenly Fire;Nein;;
1986;Love You Forever;Robert Munsch, Sheila McGraw;en-GB;Intermediate;12510;159703;genre fiction;1309.77;785.862;0.99;79;Amazon Digital Services,  Inc.;1323;Love You Forever;Nein;;
2006;Cell;Stephen King;en-US;Intermediate;23437;144591;genre fiction;5933.78;3.560.268;19.815,00  ;80;HarperCollins Publishers;1307;Cell;Ja;;
2013;The Boys in the Boat: Nine Americans and Their Epic Quest for Gold at the 1936 Berlin Olympics;Daniel James Brown;eng;Intermediate;11780;113565;genre fiction;8482.43;5.089.458;18.050,00  ;80;Hachette Book Group;1307;The Boys in the Boat;Nein;;
1977;The Silmarillion;J.R.R. Tolkien, Christopher Tolkien, Ted Nasmith;eng;Intermediate;31837;134106;genre fiction;6447.08;3.868.248;36.251,00  ;81;Random House LLC;1292;The Silmarillion;Nein;;
1987;The Drawing of the Three;Stephen King;eng;Intermediate;45017;139052;nonfiction;2539.24;1.523.544;36.161,00  ;82;HarperCollins Publishers;1276;The Drawing of the Three;Nein;;
2008;The Forgotten Garden;Kate Morton;en-GB;Intermediate;45995;138377;genre fiction;4907.7;0.0;36.220,00  ;85;Amazon Digital Services,  Inc.;1230;The Forgotten Garden;Nein;;
1925;Der Proze√É≈∏;Franz Kafka, Edwin Muir, Willa Muir, Max Brod;eng;Intermediate;35855;131856;genre fiction;1202.85;0.0;0.99;86;Amazon Digital Services,  Inc.;1215;Der Prozess;Ja;;
2002;This Lullaby;Sarah Dessen;eng;Intermediate;45720;151829;genre fiction;2417.85;1450.71;36.161,00  ;86;HarperCollins Publishers;1215;This Lullaby;Nein;;
2000;Plain Truth;Jodi Picoult;eng;Intermediate;35490;128406;genre fiction;1188.0;0.0;0.99;87;Amazon Digital Services,  Inc.;1200;Plain Truth;Ja;;
2010;Orange Is the New Black: My Year in a Women's Prison;Piper Kerman;eng;Intermediate;45841;127186;fiction;2388.0;0.0;36.161,00  ;87;Amazon Digital Services,  Inc.;1200;Orange Is the New Black;Ja (TV-Serie);;
1902;The Hound of the Baskervilles;Arthur Conan Doyle, Anne Perry;eng;Intermediate;45904;154517;genre fiction;2356.16;1.413.696;36.161,00  ;88;Macmillan;1184;The Hound of the Baskervilles;Ja;;
2011;Thinking, Fast and Slow;Daniel Kahneman;eng;Intermediate;45873;136950;genre fiction;1157.31;694.386;0.99;89;Amazon Digital Services,  Inc.;1169;Thinking, Fast and Slow;Nein;;
1982;The Mists of Avalon;Marion Zimmer Bradley;eng;Intermediate;45995;157736;genre fiction;1157.31;694.386;0.99;89;Amazon Digital Services,  Inc.;1169;The Mists of Avalon;Ja;;
1970;Are You There God? It's Me, Margaret;Judy Blume;eng;Intermediate;32568;151789;genre fiction;1111.77;0.0;0.99;92;Amazon Digital Services,  Inc.;1123;Are You There God? It's Me, Margaret;Ja;;
2002;Nights in Rodanthe;Nicholas Sparks;eng;Intermediate;30011;129807;genre fiction;5603.77;3.362.262;36.251,00  ;92;Amazon Digital Services,  Inc.;1123;Nights in Rodanthe;Ja;;
2014;Mr. Mercedes;Stephen King;eng;Intermediate;33664;125847;genre fiction;2202.93;1.321.758;36.161,00  ;93;Macmillan;1107;Mr. Mercedes;Ja;;
2007;All Together Dead;Charlaine Harris;eng;Intermediate;45781;162689;genre fiction;6983.24;4.189.944;18.050,00  ;95;Random House LLC;1076;All Together Dead;Ja (TV-Serie);;
1997;Midwives;Chris Bohjalian;en-US;Intermediate;35490;133155;genre fiction;6885.89;4.131.534;18.050,00  ;96;Random House LLC;1061;Midwives;Nein;;
1985;The Polar Express;Chris Van Allsburg;en-US;Intermediate;47209;168001;nonfiction;1035.54;621.324;0.99;97;Amazon Digital Services,  Inc.;1046;The Polar Express;Ja;;
1989;The True Story of the Three Little Pigs;Jon Scieszka, Lane Smith;en-GB;Intermediate;47209;141945;genre fiction;1019.7;0.0;0.99;98;Amazon Digital Services,  Inc.;1030;The True Story of the Three Little Pigs;Ja;;
1987;Patriot Games;Tom Clancy;eng;Intermediate;45965;141674;genre fiction;6079.85;0.0;36.281,00  ;99;Amazon Digital Services,  Inc.;1015;Patriot Games;Ja;;
1998;Veronika decide morrer;Paulo Coelho, Margaret Jull Costa;eng;Intermediate;25263;111856;genre fiction;6932.45;4159.47;30.468,00  ;99;Penguin Group (USA) LLC;1015;Veronika decide morrer;Ja;;
2013;Lean In: Women, Work, and the Will to Lead;Sheryl Sandberg, Nell Scovell;eng;Intermediate;34394;135635;genre fiction;985.05;0.0;0.99;101;Amazon Digital Services,  Inc.;995;Lean In: Women, Work, and the Will to Lead;Nein;Lean In: Women, Work, and the Will to Lead;
2005;Dead as a Doornail ;Charlaine Harris;eng;Intermediate;45661;169560;genre fiction;5068.8;3041.28;45.996,00  ;102;Penguin Group (USA) LLC;990;Dead as a Doornail;Nein;Dead as a Doornail ;
2011;Shatter Me (Shatter Me, #1);Tahereh Mafi;en-US;Intermediate;45661;176433;fiction;2195.2;1317.12;45.323,00  ;104;Amazon Digital Services,  Inc.;980;Shatter Me;Ja;Shatter Me (Shatter Me, #1);
1959;Starship Troopers;Robert A. Heinlein;en-CA;Intermediate;36220;136886;genre fiction;7312.5;4387.5;45.784,00  ;105;Hachette Book Group;975;Starship Troopers;Ja;Starship Troopers;
2011;I've Got Your Number;Sophie Kinsella;eng;Intermediate;34029;144533;genre fiction;960.3;0.0;0.99;106;Amazon Digital Services,  Inc.;970;I've Got Your Number;Nein;I've Got Your Number;
1991;Sofies Verden;Jostein Gaarder, Paulette M√É¬∏ller;eng;Intermediate;32203;109692;genre fiction;10224.0;6134.4;24.016,00  ;108;Penguin Group (USA) LLC;960;Sofies Verden (Sofies Welt);Ja;Sofies Verden;
2011;;Mark Cotta Vaz;eng;Intermediate;45720;188136;genre fiction;7670.4;4602.24;36.342,00  ;108;Penguin Group (USA) LLC;960;;;;
1950;The Martian Chronicles;Ray Bradbury;en-US;Intermediate;45995;143236;genre fiction;1880.55;0.0;36.161,00  ;111;Amazon Digital Services,  Inc.;945;The Martian Chronicles;Nein;The Martian Chronicles;
2010;A Visit From the Goon Squad;Jennifer Egan;eng;Intermediate;23437;120126;genre fiction;4690.6;2814.36;36.251,00  ;112;Macmillan;940;A Visit From the Goon Squad;Ja;A Visit From the Goon Squad;
1880;Heidi;Johanna Spyri, Angelo  Rinaldi, Beverly Cleary;eng;Intermediate;35490;144497;genre fiction;3730.65;2238.39;36.220,00  ;113;Penguin Group (USA) LLC;935;Heidi;Ja;Heidi;
2002;Prey;Michael Crichton;;Intermediate;26359;131352;genre fiction;1850.7;0.0;36.161,00  ;114;Amazon Digital Services,  Inc.;930;Prey;Ja;Prey;
1956;The Last Battle;C.S. Lewis;eng;Intermediate;45692;158701;genre fiction;5980.0;3588.0;45.783,00  ;116;Amazon Digital Services,  Inc.;920;The Last Battle;Nein;The Last Battle;
2007;World Without End;Ken Follett;eng;Intermediate;45017;128715;genre fiction;905.85;543.51;0.99;117;Random House LLC;915;World Without End;Nein;World Without End;
2008;Chosen: A House of Night Novel;P.C. Cast, Kristin Cast;en-US;Intermediate;45903;180961;fiction;7759.2;4655.52;17.746,00  ;117;Amazon Digital Services,  Inc.;915;Chosen: A House of Night Novel;Ja;Chosen: A House of Night Novel;
2012;Slammed;Colleen Hoover;eng;Intermediate;47209;153882;genre fiction;900.9;0.0;0.99;118;Amazon Digital Services,  Inc.;910;Slammed;Ja;Slammed;
2007;Beastly (Beastly, #1, Kendra Chronicles, #1);Alex Flinn;eng;Intermediate;30742;150003;genre fiction;895.95;537.57;0.99;119;Amazon Digital Services,  Inc.;905;Beastly;Ja;Beastly (Beastly, #1, Kendra Chronicles, #1);
1390;Tales of Caunterbury;Geoffrey Chaucer, Nevill Coghill;eng;Novice;17593;148480;genre fiction;891.0;0.0;0.99;120;Amazon Digital Services,  Inc.;900;Tales of Canterbury;Nein;Tales of Caunterbury;
2006;Baby Proof;Emily Giffin;en-US;Intermediate;25993;124371;nonfiction;5841.0;3504.6;18.050,00  ;120;Macmillan;900;Baby Proof;Ja;Baby Proof;
2011;Inheritance;Christopher Paolini;en-US;Intermediate;45873;146905;nonfiction;10731.05;6438.63;36.465,00  ;121;Random House LLC;895;Inheritance;Ja;Inheritance;
2009;√£¬Å‚Äû√£¬Å¬°√£¬Å¬ç√£‚Äö‚Ä¶√£¬Å‚Ä†√£¬Å¬Ø√£¬Å¬°√£‚ÄöÀÜ√£‚Äö‚Äú [Ichi-Ky√Ö¬´-Hachi-Yon];Haruki Murakami, Jay Rubin, Philip Gabriel;eng;Intermediate;32568;125195;genre fiction;2661.1;0.0;36.192,00  ;122;Amazon Digital Services,  Inc.;890;;;√£¬Å‚Äû√£¬Å¬°√£¬Å¬ç√£‚Äö‚Ä¶√£¬Å‚Ä†√£¬Å¬Ø√£¬Å¬°√£‚ÄöÀÜ√£‚Äö‚Äú [Ichi-Ky√Ö¬´-Hachi-Yon];
1852;Uncle Tom's Cabin or Life Among the Lowly;Harriet Beecher Stowe;eng;Intermediate;30376;137858;fiction;1771.1;1062.66;36.161,00  ;122;HarperCollins Publishers;890;Uncle Tom's Cabin;Ja;Uncle Tom's Cabin or Life Among the Lowly;
1909;Le Fant√É¬¥me de l'Op√É¬©ra;Gaston Leroux, Alexander Teixeira de Mattos;eng;Intermediate;35490;141110;genre fiction;3531.15;0.0;36.220,00  ;123;Amazon Digital Services,  Inc.;885;Le FantÙme de l'OpÈra;Nein;Le Fant√É¬¥me de l'Op√É¬©ra;
2006;Definitely Dead (Sookie Stackhouse, #6);Charlaine Harris;en-US;Intermediate;45692;163054;genre fiction;6525.0;3915.0;45.784,00  ;126;Simon and Schuster Digital Sales Inc;870;Definitely Dead;Ja;Definitely Dead (Sookie Stackhouse, #6);
1995;Ensaio Sobre a Cegueira;Jos√É¬© Saramago, Giovanni Pontiero;en-US;Intermediate;45873;98738;genre fiction;3451.35;0.0;36.220,00  ;127;Amazon Digital Services,  Inc.;865;Ensaio Sobre a Cegueira;Nein;Ensaio Sobre a Cegueira;
2010;Freedom;Jonathan Franzen;en-US;Intermediate;26724;119213;genre fiction;6871.4;4122.84;36.342,00  ;128;Random House LLC;860;Freedom;Nein;Freedom;
2011;Crossed;Ally Condie;eng;Intermediate;19054;100886;genre fiction;841.5;504.9;0.99;130;Amazon Digital Services,  Inc.;850;Crossed;Nein;Crossed;
2006;I'd Tell You I Love You, But Then I'd Have to Kill You;Ally Carter;en-US;Intermediate;30011;150222;genre fiction;10131.55;6078.93;36.465,00  ;131;Hachette Book Group;845;I'd Tell You I Love You, But Then I'd Have to Kill You;Ja;I'd Tell You I Love You, But Then I'd Have to Kill You;
2008;The White Tiger;Aravind Adiga;eng;Intermediate;25993;114531;genre fiction;6711.6;4026.96;36.342,00  ;132;Random House LLC;840;The White Tiger;Nein;The White Tiger;
2001;The Corrections;Jonathan Franzen;eng;Intermediate;28550;117657;genre fiction;816.75;0.0;0.99;135;Amazon Digital Services,  Inc.;825;The Corrections;Nein;The Corrections;
1995;Dreams from My Father;Barack Obama;eng;Intermediate;29646;128961;nonfiction;1641.75;985.05;36.161,00  ;135;HarperCollins Publishers;825;Dreams from My Father;Ja;Dreams from My Father;
1980;Congo;Michael Crichton;eng;Intermediate;20149;129811;nonfiction;5696.85;3418.11;36.312,00  ;137;Random House LLC;815;Congo;Nein;Congo;
1972;Alexander and the Terrible, Horrible, No Good, Very Bad Day;Judith Viorst, Ray Cruz;en-CA;Intermediate;44652;146073;genre fiction;2421.9;0.0;36.192,00  ;138;Amazon Digital Services,  Inc.;810;Alexander and the Terrible...;Nein;Alexander and the Terrible, Horrible, No Good, Very Bad Day;
1999;Interpreter of Maladies;Jhumpa Lahiri;eng;Intermediate;45995;110651;genre fiction;8573.25;5143.95;24.016,00  ;139;Penguin Group (USA) LLC;805;Interpreter of Maladies;Nein;Interpreter of Maladies;
1980;A People's History of the United States: 1492 to Present ;Howard Zinn;eng;Intermediate;45842;137372;genre fiction;3192.0;0.0;36.220,00  ;140;Amazon Digital Services,  Inc.;800;A People's History of the United States;Ja;A People's History of the United States: 1492 to Present ;
1958;Breakfast at Tiffany's;Truman Capote;eng;Intermediate;32568;129778;genre fiction;792.0;475.2;0.99;140;Amazon Digital Services,  Inc.;800;Breakfast at Tiffany's;Nein;Breakfast at Tiffany's;
2010;The Passage;Justin Cronin;eng;Intermediate;45751;126993;genre fiction;3172.05;0.0;36.220,00  ;141;Amazon Digital Services,  Inc.;795;The Passage;Nein;The Passage;
2005;Anansi Boys;Neil Gaiman;eng;Intermediate;4.0;137639;nonfiction;1572.1;943.26;36.161,00  ;142;Amazon Digital Services,  Inc.;790;Anansi Boys;Nein;Anansi Boys;
2009;Along for the Ride;Sarah Dessen;eng;Intermediate;45873;151721;genre fiction;9412.15;5647.29;36.465,00  ;143;Penguin Group (USA) LLC;785;Along for the Ride;Ja;Along for the Ride;
2014;Everything I Never Told You;Celeste Ng;eng;Intermediate;28550;108703;genre fiction;3112.2;0.0;36.220,00  ;144;Amazon Digital Services,  Inc.;780;Everything I Never Told You;Ja;Everything I Never Told You;
